{
  "schema": "mirrorgate.port/v1",
  "interfaceDigest": "193d6cc187d05c18f02ad483a44f8ad0c1634b02083df241df08b9281b045d1c",
  "initializers": [
    { "id": "Initialize", "inputs": [] }
  ],
  "actions": [
    {
      "id": "Tick",
      "inputs": [{ "id": "Stride", "type": { "kind": "int" } }]
    }
  ],
  "observations": [
    { "id": "Count", "type": { "kind": "int" } }
  ]
}
